KEY,English,Deutsch,Français,Italiano,Spanish,Portuguese (Euro),Portuguese (Brazil),Polish,Russian,Japanese,Chinese (simplified),Chinese (traditional),Korean,Turkish,Greek,Dutch,Vietnamese
pda_eG0W8,"The [c][00ffff]player inventory[-][/c] window displays all resource and personal status information - your health, wounds, hunger, etc.\n\nIn addition, if you suffer or benefit from any [c][00ffff]status effect[-][/c], refer to the status panel in your inventory window to find a suitable remedy.","Das [c][00ffff]Spielerinventar[-][/c]-Fenster zeigt alle Ressourcen- und persönlichen Statusinformationen an - Deine Gesundheit, Wunden, deinen Hunger usw.\n\n Außerdem kannsst du, wenn du unter einem [c][00ffff]Statuseffekt[-][/c] leidest oder davon profitierst, in der Statustafel in deinem Inventarfenster nach einem geeigneten Mittel suchen.","La fenêtre [00ffff]d'inventaire du joueur[-] affiche toutes les informations sur les ressources et le statut personnel - votre santé, vos blessures, votre faim, etc. \n\nEn outre, si vous souffrez ou êtes atteint d'un [00ffff]Effet[-] particulier, reportez-vous au panneau d'état de votre fenêtre d'inventaire (bouton [statistiques]), pour trouver un remède approprié.","La schermata[c][00ffff] Inventario[-][/c] mostra tutti gli oggetti che possiedi e le tue statistiche personali - salute, ferite, fame, etc.\n\nIn aggiunta, se soffri o trai beneficio di qualche [c][00ffff]effetto di stato[-][/c], fai riferimento al pannello di stato nella finestra del tuo inventario per trovare il rimedio adeguato.","La ventana de [c][00ffff]inventario del jugador[-][/c] muestra toda la información de recursos y estado personal - tu salud, heridas, hambre, etc.\n\nAdemás, si sufres o te beneficias de algún [c][00ffff]efecto de estado[-][/c], consulta el panel de estado en la ventana de inventario para encontrar un remedio adecuado.",,,,"Окно [c][00ffff]инвентаря игрока[-][/c] отображает всю информацию о ресурсах и личном статусе - ваше здоровье, раны, голод и т.д.\n\nКроме того, если вы страдаете или получаете пользу от какого-либо [c][00ffff]эффекта статуса[-][/c], обратитесь к панели состояния в окне инвентаря, чтобы найти подходящее лекарство.",[c][00ffff]プレイヤーのインベントリウィンドウ[-][/c]には、健康、傷、空腹など、すべてのリソースと個人のステータス情報が表示されます。\n\nさらに、[c][00ffff]ステータス効果[-][/c]に苦しんでいる、または恩恵を受けている場合は、インベントリウィンドウのステータスパネルを参照して、適切な救済策を見つけてください。,[c][00ffff]玩家背包[-][/c] 窗口会显示所有资源和个人状态信息——你的生命、伤势、饥饿等。\n\n此外，如果你受到或获得任何 [c][00ffff]状态效果[-][/c]，请查看背包窗口中的状态面板以找到合适的解决方法。,,,"[c][00ffff]Oyuncu envanteri[-][/c] penceresi üzerindeki tüm eşyaları ve sağlık durumun ile ilgili bilgileri gösterir - sağlık, yaralar, açlık ve bunun gibi bilgiler. Eğer olumlu veya olumsuz herhangi bir [c][00ffff]durum değişikliği[-][/c] yaşarsan, uygun bir çözüm için envanter pencerende bulunan durum paneline bak.",,,
pda_GCKaa,"In case you missed or overlooked a message, you can review them later in the [c][00ff00]PDA LOG[-][/c][c][00ffff][-][/c]with the following steps:\n\n1. Select the  [c][00ffff]HEADLINE  [-][/c]of the currently [c][00ffff]ACTIVE mission[-][/c] from the chapter list on the left. (For example '1. Basic Survival')\n2. Click on the button [c][00ffff]PDA LOG[-][/c] on the [c][00ffff]top right[-][/c].\n\n[u]Notes:[/u] \n- A mission always has [c][00ffff]ONE CHAPTER headline[-][/c] and (often) [c][00ffff]several TASKS[-][/c]. The [u]active[/u] mission and the tasks (bullet points) are visible in the list of the right.  \n- Each task can have one or several [c][00ffff]ACTIONS[-][/c]. The actions are displayed on the right side when you click on a task in the list on the left side. A brief list of all the actions of a task can be found on the top right area. \n\n[u][c][ff7b00]IMPORTANT[-][/c]![/u]\nEach ACTION also has a checkbox. Most of the actions can be solved manually in case something breaks. Just click on the checkbox in front of the broken action to complete it  [c][ff7b00]BUT consider making a SAVE GAME [u]BEFORE resolving the action (!!)[/u] and send it in together with bug report in the game forums over at [-][/c][c][00ffff]empyriononline.com[-][/c][c][ff7b00]! [-][/c]\n\nYour contribution will help to fix and improve the missions and tutorials! :)","Falls du eine Nachricht verpasst oder übersehen hast, kannst du sie später im [c][00ff00]PDA LOG[-][/c][c][00ffff][-][/c]mit den folgenden Schritten überprüfen:\n\n1. Wählee die [c][00ffff]HEADLINE[-][/c]der aktuell [c][00ffff]AKTIVEN Mission[-][/c] aus der Kapitelliste auf der linken Seite. (Zum Beispiel '1. Überleben')\n2. Klicke auf die Schaltfläche [c][00ffff]PDA LOG[-][/c] oben rechts[-][/c].\n\n[u]Hinweise:[/u] \n- Eine Mission hat immer eine[c][00ffff]Überschrift für EIN KAPITEL[-][/c] und (oft) [c][00ffff]mehrere AUFGABEN[-][/c]. Die [u]aktive[/u] Mission und die Aufgaben (Aufzählungspunkte) sind in der Liste rechts sichtbar.  \n- Jede Aufgabe kann eine oder mehrere [c][00ffff]AKTIONEN[-][/c] haben. Die Aktionen werden auf der rechten Seite angezeigt, wenn du auf eine Aufgabe in der Liste auf der linken Seite klickst. Eine kurze Auflistung aller Aktionen einer Aufgabe findest du im rechten oberen Bereich. \n\n[u][c][ff7b00]WICHTIG[-][/c]![/u]\nJede AKTION hat auch ein Kontrollkästchen. Die meisten der Aktionen können manuell gelöst werden, falls etwas nicht funktioniert. Klicke einfach auf das Kontrollkästchen vor der gestörten Aktion, um sie abzuschließen [c][ff7b00]ABER denke daran, ein SAVE GAME zu machen [u]BEVOR du die Aktion auflöst (!!)[/u] und es zusammen mit einem Bug-Report im Spielforum auf [-][/c][c][00ffff]empyriononline.com[-][/c][c][ff7b00] einzusenden! [-][/c]Dein Beitrag wird helfen, die Missionen und Tutorials zu reparieren und zu verbessern! :)\n\n","Si vous avez manqué ou oublié un message, vous pouvez le retrouver via l'onglet [00ffff]Journal PDA[-] de votre PDA, en procédant comme suit : \n1- Sélectionnez le [00ffff]TITRE[-] de la [00ffff]mission ACTIVE[-] dans la liste de la fenêtre de gauche. (Ex: «les bases de la survie») \n2- Cliquez sur le bouton [00ffff]Journal PDA[-] en haut à droite. \n\nUne mission a toujours un [00ffff]TITRE[-] et souvent plusieurs [00ffff]CHAPITRES[-]. \n- Quand vous voulez consulter les tâches d'un chapitre, sélectionnez-le dans la fenêtre de gauche, puis cliquez sur le bouton [00ffff]Infos PDA[-] en haut à droite. \n- Chaque chapitre peut contenir une ou plusieurs [00ffff]TÂCHES[-]. Les tâches sont affichées sur la fenêtre de droite. Une brève liste de toutes les tâches se trouve au-dessus de la fenêtre de droite. \n\n[u][ff7b00]IMPORTANT![-][/u] \nChaque tâche possède également une case à cocher. La plupart des tâches peuvent être terminées manuellement en cas de problème. Cliquez simplement sur la case à cocher située devant la tâche en cours pour la terminer, [ff7b00][u]MAIS pensez à faire une SAUVEGARDE (en quittant la partie), AVANT de terminer la tâche !! et envoyez-la avec le rapport de bug sur le forum du jeu sur[-][/u]  \n[00ffff]empyriononline.com[-][c][ff7b00][-] \n\nVotre contribution aidera à corriger et améliorer les missions et les tutoriels! :)\n","Se ti perdi un messaggio, puoi rileggerlo nella sezione [c][00ffff]DIARIO[-][/c][c][00ffff][-][/c]in qualsiasi momento. Per farlo:\n\n1. Seleziona il  [c][00ffff]TITOLO  [-][/c]dell'attuale [c][00ffff]missione ATTIVA[-][/c] dalla lista dei capitoli sulla sinistra. (Per esempio '1. Sopravvivenza di Base')\n2. Clicca sul pulsante [c][00ffff]DIARIO PDA[-][/c] in [c][00ffff]alto a destra[-][/c].\n\n[u]Nota:[/u] \n- Una missione ha sempre il [c][00ffff]titolo del CAPITOLO[-][/c] e (spesso) [c][00ffff]diversi OBBIETTIVI[-][/c]. La missione [u]attiva[/u] e gli obbiettivi sono visibili nella lista a destra.  \n- Ogni obbiettivo può avere diverse [c][00ffff]AZIONI[-][/c]. Le azioni vengono mostrate nella parte destra cliccando nella lista sulla parte a sinistra. A brief list of all the actions of a task can be found on the top right area. \n\n[u][c][ff7b00]IMPORTANTE[-][/c]![/u]\nOgni AZIONE possiede delle caselle di completamento. Most of the actions can be solved manually in case something breaks. Just click on the checkbox in front of the broken action to complete it  [c][ff7b00]BUT consider making a SAVEGAME [u]BEFORE resolving the action (!!)[/u] and send it in together with bug report in the game forums over at [-][/c][c][00ffff]empyriononline.com[-][/c][c][ff7b00]! [-][/c]\n\nIl tuo contributo aiuterà a sistemare e migliorare le missioni e i tutorial! :)",,,,,"Если вы пропустили или пропустите сообщение, вы сможете просмотреть его позже в [c][00ff00]КПК Журнал[-][/c][c][00ffff][-][/c]выполнив следующие действия:\n\n1. Выберите  [c][00ffff]ЗАГОЛОВОК [-][/c]текущей [c][00ffff]АКТИВНОЙ миссии[-][/c] из списка глав слева. (Например, «1. Основы выживания»)\n2. Нажмите кнопку [c][00ffff]КПК Журнал[-][/c] в [c][00ffff]правом верхнем углу[-][/c].\n\n[u]Примечания:[/u] \n- У миссии всегда есть [c][00ffff]ОДИН заголовок[-][/c] и (часто) [c][00ffff]несколько ЗАДАЧ[-][/c]. [u]Активная[/u]миссия и задачи (точки) отображаются в списке справа.  \n- Каждая задача может иметь одно или несколько [c][00ffff]ДЕЙСТВИЙ[-][/c]. Действия отображаются справа, когда вы щелкаете задачу в списке слева. Краткий список всех действий задачи можно найти в правом верхнем углу. \n\n[u][c][ff7b00]ВАЖНОЕ[-][/c]![/u]\nУ каждого ДЕЙСТВИЯ также есть флажок. Большинство действий можно решить вручную, если что-то сломается. Просто установите флажок перед нарушенным действием, чтобы завершить его  [c][ff7b00]НО подумайте о том, чтобы сделать СОХРАНЕНИЕ [u]ПЕРЕД разрешением действия (!!)[/u] и отправьте его вместе с отчетом об ошибке в игровые форумы на [-][/c][c][00ffff]empyriononline.com[-][/c][c][ff7b00]! [-][/c]\n\nВаш вклад поможет исправить и улучшить миссии и обучающие программы! :)",メッセージを見逃したり見落としたりした場合は、後で[c][00ff00]PDAログ[-][/c][c][00ffff][-][/c]で次の手順で確認できます：\n\n1.左側のチャプターリストから、現在[c][00ffff]アクティブなミッション[-][/c]の[c][00ffff]ヘッドライン[-][/c]を選択します。 （例：「1.基本的なサバイバル」）\n2.[c][00ffff]右上[-][/c]の[c][00ffff]PDAログ[-][/c]ボタンをクリックします。\n\n[u]注意：[/u]\n- ミッションには、常に[c][00ffff]1つの章の見出し[-][/c]と（多くの場合）[c][00ffff]複数のタスク[-][/c]があります。[u]アクティブ[/u]なミッションとタスク（箇条書き）が右側のリストに表示されます。 \n- 各タスクには、1つまたは複数のアクションを含めることができます。左側のリストでタスクをクリックすると、[c][00ffff]アクション[-][/c]が右側に表示されます。タスクのすべてのアクションの簡単なリストは、右上の領域にあります。\n\n[u][c][ff7b00]重要！[-][/c][/u]\n各アクションにはチェックボックスもあります。何かが壊れた場合に備えて、ほとんどのアクションは手動で解決できます。壊れたアクションの前にあるチェックボックスをクリックして完了しますが、[c][ff7b00][u]アクションを解決する前に[/u]セーブゲームを作成して（!!）、[-][/c][c][00ffff]empyriononline.com[-][/c][c][ff7b00]のゲームフォーラムでバグレポートと一緒に送信することを検討してください！[-][/c]\n\nあなたの貢献は、ミッションとチュートリアルの修正と改善に役立ちます！ :),如果你错过或忽略了某条信息，可以稍后在 [c][00ff00]PDA日志[-][/c][c][00ffff][-][/c] 中按以下步骤查看：\n\n1. 在左侧章节列表中选择当前 [c][00ffff]活跃任务[-][/c] 的 [c][00ffff]标题[-][/c]。（例如 “1. 基础生存”）\n2. 点击右上角的 [c][00ffff]PDA日志[-][/c] 按钮。\n\n[u]说明：[/u] \n- 一个任务始终只有 [c][00ffff]一个章节标题[-][/c]，并且（通常）包含 [c][00ffff]多个任务目标[-][/c]。[u]当前激活[/u]的任务和目标（项目符号）会显示在右侧列表中。  \n- 每个任务目标可以包含一个或多个 [c][00ffff]行动[-][/c]。当你点击左侧列表中的某个任务目标时，相关行动会显示在右侧。该任务目标的所有行动简要列表也会显示在右上区域。 \n\n[u][c][ff7b00]重要[-][/c]！[/u]\n每个行动旁边都有一个复选框。如果某个行动出现问题，大多数情况下可以手动完成。只需点击损坏行动前面的复选框即可完成它 [c][ff7b00]但请务必在解决行动 [u]之前保存游戏（！！）[/u]，并将存档连同错误报告一起提交到游戏论坛 [-][/c][c][00ffff]empyriononline.com[-][/c][c][ff7b00]！[-][/c]\n\n你的贡献将有助于修复和改进任务与教程！ :),,,"Eğer herhangi bir mesajı gözden kaçırırsan, [c][00ff00]PDA LOG[-][/c][c][00ffff][-][/c] içinde şu adımları takip ederek bulabilirsin :\n\n1. Sol tarafta bulunan bölüm listesinden [c][00ffff]AKTİF görev [-][/c] [c][00ffff]BAŞLIĞINI  [-][/c] seçerek bulabilirsin. (Mesela 1. Hayatta Kalma Temelleri')\n2.[c][00ffff]sağ üstte[-][/c] bulunan [c][00ffff]PDA LOG[-][/c] düğmesine basabilirsin.\n\n[u]Notlar:[/u] \n- Görevlerin her zaman [c][00ffff]BÖLÜM BAŞLIĞI[-][/c] ve (sıklıkla) [c][00ffff]birkaç ALT GÖREV[-][/c] vardır. [u]Aktif[/u] görevler ve alt görevleri sağ taraftaki listede görebilirsin.  \n- Her görev bir veya daha fazla [c][00ffff]ALT GÖREVE[-][/c] sahip olabilir. Bu alt görevler, sol taraftaki ana göreve tıkladığınızda sağ tarafta görünür. Tüm alt görevlerin listesi sağ üst kısımda bulunur. \n\n[u][c][ff7b00]ÖNEMLİ[-][/c]![/u]\nTüm alt görevlerin yanında bir işaretlenebilir kutu bulunur. Eğer oyunda herhangi bir problem çıkarsa kutuyu kendiniz işaretleyerek o alt görevi yapmış gibi bitirebilirsiniz.[c][ff7b00]ANCAK [u]sorunu bu şekilde ÇÖZMEDEN ÖNCE (!!)[/u] oluşabilecek herhangi bir probleme karşı önce oyunu kaydedin ve oyunun forum sitesine hata raporu gönderin. [-][/c][c][00ffff]empyriononline.com[-][/c][c][ff7b00]! [-][/c]\n\nSizin desteğiniz görevlerin ve eğitici bilgilerin düzeltilip daha iyi bir hale gelmesinde yardımcı olacak! :)",,,
pda_8480e,"Next, move your [c][00ffff]Survival Tool[-][/c] onto your toolbar. \n\nYou can use [c][00ff00]SHIFT+LMB[-][/c] to quickly move any item between your inventory and your toolbar!","Verschiebe als nächstes dein [c][00ffff]Überlebenswerkzeug[-][/c] auf deine Zugriffsleiste. \Du kannst [c][00ff00]UMSCH+LMB[-][/c] verwenden, um jeden Gegenstand schnell zwischen deinem Inventar und deiner Zugriffsleiste zu verschieben!","Ensuite, déplacez votre [00ffff]Outil de survie[-] sur votre barre outils. \n\nVous pouvez utiliser [00ff00]Maj+Clic gauche[-] pour déplacer rapidement n'importe quel élément entre votre inventaire et votre barre outils!",Ora sposta il tuo [c][00ffff]Strumento di Sopravvivenza[-][/c] nella barra degli strumenti. \n\nPuoi utilizzare [c][00ff00]MAIUSC+PSM[-][/c] per muovere rapidamente qualsiasi oggetto tra il tuo inventario e la barra degli strumenti!,"A continuación, mueve tu [c][00ffff]Herramienta de Supervivencia[-][/c] a la barra de herramientas. \n\n¡Puedes usar [c][00ff00]SHIFT+BIR[-][/c] para mover rápidamente cualquier artículo entre tu inventario y la barra de herramientas!",,,,Затем переместите ваш [c][00ffff]Инструмент выживания[-][/c] на свою панель инструментов. \n\nВы можете использовать [c][00ff00]SHIFT+ЛКМ[-][/c] для быстрого перемещения любого предмета между вашим инвентарем и панелью инструментов!,次に、[c][00ffff]サバイバルツール[-][/c]をツールバーに移動します。 \n\n[c][00ff00]SHIFT + LMB[-][/c]を使用して、インベントリとツールバーの間でアイテムをすばやく移動できます。,接下来，将你的 [c][00ffff]生存工具[-][/c] 放到工具栏上。 \n\n你可以使用 [c][00ff00]SHIFT+LMB[-][/c] 在背包和工具栏之间快速移动任何物品！,,,"Devam edelim, [c][00ffff]Hayatta kalma silahını[-][/c] araç çubuğuna taşı. \n\n Herhangi bir eşyayı envanter ve araç çubuğu arasında hızlıca taşımak için [c][00ff00]SHIFT+Sol fare tuşu[-][/c] kullanabilirsin!",,,
pda_WGOiC,"Change the Tool Mode with [c][4cd22e]RMB[-][/c]. \n\n- [c][00ffff]Defense[-][/c]: use this mode for defending against small animals. It is suggested that you walk around with Defense mode activated, as small spiders and insects may attack you. \n\n- [c][00ffff]Drill[-][/c]: use this mode for extracting ore from rocks or from underground deposits. \n\nNote: make use of your personal drone [c][4cd22e]({keybind(PlayerDrone)})[-][/c] for mining underground deposits to avoid getting trapped in a deep mining hole. \n\n- [c][00ffff]Salvage[-][/c]: use this mode for recovering usable materials from wrecks.","Ändere den Werkzeugmodus mit [c][4cd22e]RMB[-][/c]. \c][00ffff]Verteidigung[-][/c]: Verwende diesen Modus zur Verteidigung gegen kleine Tiere. Es wird empfohlen, mit aktiviertem Verteidigungsmodus herumzulaufen, da kleine Spinnen und Insekten dich angreifen können. \n\n- [c][00ffff]Rohstoffabbau[-][/c]: Verwende diesen Modus zum Abbau von Erz aus Felsen oder unterirdischen Lagerstätten. \n\nHinweis: Verwende deine persönliche Drohne [c][4cd22e]({keybind(PlayerDrone)})[-][/c] für den Abbau unterirdischer Lagerstätten, um zu vermeiden, dass du in einem tiefen Abbauloch gefangen bist. \[c][00ffff]BZerlegen[-][/c]: Verwende diesen Modus, um verwertbare Materialien aus Wracks zu bergen.\n","Modifiez le mode Outil avec [4cd22e]Clic droit[-]. \n- Mode Défense: utilisez ce mode pour vous défendre contre les petits animaux. Il est conseillé d'activer ce mode quand vous marchez, car des araignées et des insectes Alien peuvent vous attaquer. \n- Extraire ressources: utilisez ce mode pour extraire le minerai des roches ou des gisements souterrains. \nNote: vous pouvez utilisez votre drone personnel [4cd22e]{keybind(PlayerDrone)}[-] pour exploiter les gisements souterrains afin d'éviter d'être piégé dans un trou trop profond. \n- Désassembler: utilisez ce mode pour récupérer des matériaux réutilisables sur des épaves.\n\nUne fois le mode choisi, utilisez l'Outil de survie [4cd22e]Clic gauche[-].","Cambia la modalità strumento con [c][4cd22e]PDM;[-][/c]. \n\n- [c][00ffff]Difesa[-][/c]: usa questa modalità per difenderti da animali piccoli. È consigliabile tenere sempre attiva la modalità Difesa durante l'esplorazione, dal momento che ragni e piccoli insetti potrebbero attaccarti\n\n- [c][00ffff]Trivellazione[-][/c]: usa questa modalità per estrarre minerali dalle rocce o dai depositi sotterranei. \n\nNota: puoi far uso del tuo drone personale [c][4cd22e]({keybind(PlayerDrone)})[-][/c] per trivellare i depositi sotterranei ed evitare di rimanere intrappolato in un buco profondo.\n\n- [c][00ffff]Smonta[-][/c]: usa questa modalità per recuperare materiali utilizzabili dai rottami.","Cambia el modo de la herramienta con [c][4cd22e]BDR[-][/c]. \n\n- [c][00ffff]Defensa[-][/c]: usa este modo para defenderte de animales pequeños. Se recomienda que camines con el modo de Defensa activado, ya que las pequeñas arañas e insectos pueden atacarte. \n\n- [c][00ffff]Taladro[-][/c]: usa este modo para extraer mineral de las rocas o de depósitos subterráneos. \n\nNota: utiliza tu dron personal [c][4cd22e]({keybind(PlayerDrone)})[-][/c] para extraer depósitos subterráneos y así evitar quedar atrapado en un agujero minero profundo. \n\n- [c][00ffff]Desmontar[-][/c]: usa este modo para recuperar materiales utilizables de restos.",,,,"Измените режим инструмента с помощью [00ff00]ПКМ[-].\n\n - Защита: используйте этот режим для защиты от мелких животных. Предполагается, что вы ходите с активированным режимом защиты, так как маленькие пауки и насекомые могут напасть на вас. \n\n- Бурение: используйте этот режим для добычи руды из горных пород или подземных месторождений. Примечание: используйте свой личный дрон [00ff00](F5)[-] для добычи подземных месторождений, чтобы избежать попадания в глубокую шахту. \n\n- Деконструкция: используйте этот режим для извлечения полезных материалов из обломков.",[c][4cd22e]RMB[-][/c]でツールモードを変更します。 \n\n- [c][00ffff]防御[-][/c]：このモードを使用して、小動物から防御します。小さなクモや昆虫があなたを攻撃する可能性があるため、防御モードをアクティブにして歩き回ることをお勧めします。 \n\n- [c][00ffff]ドリル[-][/c]：このモードを使用して、岩石または地下鉱床から鉱石を抽出します。\n\n注意：深い採掘穴に閉じ込められないように、地下の鉱床を採掘するために個人用ドローン[c][4cd22e]({keybind(PlayerDrone)})[-][/c]を利用してください。 \n\n- [c][00ffff]解体回収[-][/c]：このモードを使用して、残骸から使用可能な材料を回収します。,使用 [c][4cd22e]RMB[-][/c] 切换工具模式。 \n\n- [c][00ffff]防御[-][/c]：用于防御小型动物。建议你在探索时保持防御模式开启，因为小蜘蛛和昆虫可能会攻击你。 \n\n- [c][00ffff]采矿[-][/c]：用于从岩石或地下矿床中提取矿石。 \n\n注意：在开采地下矿床时，利用你的个人无人机 [c][4cd22e]({keybind(PlayerDrone)})[-][/c]，以避免被困在深矿洞中。 \n\n- [c][00ffff]打捞[-][/c]：用于从残骸中回收可用材料。,,,"Hayatta kalma silahının modunu [c][4cd22e]Sağ fare tuşu[-][/c] ile değiştirebilirsin. \n\n- [c][00ffff]Savunma[-][/c]: Kendinizi küçük yaratıklar ve hayvanlardan korumak için bu modu kullanabilirsiniz. Etrafta savunma modu aktifleştirilmiş olarak gezmenizi tavsiye ederiz, küçük örümceklerin saldırısına uğrayabilirsiniz. \n\n- [c][00ffff]Kazma[-][/c]: Bu modu etraftaki kayalardan veya yer altındaki madenlerden cevher çıkarmak için kullanabilirsiniz. \n\nNot: Derin maden deliklerinde sıkışık kalmamak için [c][4cd22e]({keybind(PlayerDrone)})[-][/c] tuşu ile kişisel dronunuzu kullanabilirsiniz. \n\n- [c][00ffff]parçalama[-][/c]: Enkazlardan işe yarar parçalar çıkarmak için bu modu kullanabilirsiniz.",,,
